{
  "task_id": "ELY-TASK-000007",
  "worker": {
    "provider": "chatgpt",
    "role": "autopilot-supervisor",
    "model": null,
    "run_id": null
  },
  "outcome": "completed",
  "summary": "Added a side-effect-free semantic validator for provider-neutral completion packets before any future ledger state transition. It verifies task identity, worker attribution, outcome/action vocabulary, check uniqueness, required-check presence/pass state, and prevents a completed outcome from carrying explicit failed checks.",
  "files_read": [
    "elysia_collective_seed/autopilot/completion_packet_schema.json",
    "elysia_collective_seed/autopilot/dryrun_orchestrator.py",
    "elysia_collective_seed/autopilot/task_ledger.py"
  ],
  "files_changed": [
    "elysia_collective_seed/autopilot/completion_validator.py",
    "elysia_collective_seed/autopilot/test_completion_validator.py",
    "elysia_collective_seed/autopilot/handoffs/ELY-TASK-000007-completion-validation.json"
  ],
  "commits": [
    "b0f6ed7a1f59dce36e88d2c9f2b1a8e701427d3e",
    "e891abb6ed39c7a55a0743e43cfef5b426cd8cf8"
  ],
  "pull_requests": ["#12"],
  "claims": [
    {
      "claim": "Completion validation remains provider-neutral, runtime-disabled, and side-effect free.",
      "evidence": ["elysia_collective_seed/autopilot/completion_validator.py"],
      "confidence": 0.99
    },
    {
      "claim": "Regression tests cover identity mismatch, missing/nonpassing required checks, failed completed outcomes, duplicate checks, and valid partial failure reporting.",
      "evidence": ["elysia_collective_seed/autopilot/test_completion_validator.py"],
      "confidence": 0.99
    }
  ],
  "checks": [
    {
      "name": "static_safety_scope",
      "result": "pass",
      "details": "No provider invocation, subprocess, network, GitHub mutation, Guardian runtime invocation, merge, or deployment code was added."
    },
    {
      "name": "executable_ci",
      "result": "not_run",
      "details": "New branch head requires GitHub Actions execution and independent verification."
    }
  ],
  "uncertainties": ["Independent execution has not yet verified the new tests."],
  "risks": ["Semantic validation is intentionally not yet wired to mutate ledger state; premature integration would bypass the next verification gate."],
  "blockers": [],
  "next_recommendation": {
    "action": "verify",
    "preferred_role": "guardian-verifier",
    "task_title": "Verify completion packet validator and CI",
    "task_objective": "Independently review completion semantics and confirm the new branch head passes executable CI before connecting validated completions to ledger state transitions."
  },
  "completed_at": "2026-09-07T12:27:54Z"
}