{
  "task_id": "ELY-TASK-000005",
  "worker": {
    "provider": "chatgpt",
    "role": "guardian-verifier",
    "model": null,
    "run_id": null
  },
  "outcome": "completed",
  "summary": "Verified executable GitHub Actions evidence for the current AUTOPILOT-004 branch head. Elysia Autopilot CI run 34105729192 completed successfully for head a37ad0d8f839ab3935e02d2d24f894638eef7914. The seed-validation job passed checkout, Python setup, compilation, JSON parsing, the full Elysia Collective seed test invocation, and the runtime-enable safety gate.",
  "files_read": [
    "GitHub Actions run 34105729192",
    "PR #12 current head a37ad0d8f839ab3935e02d2d24f894638eef7914"
  ],
  "files_changed": [
    "elysia_collective_seed/autopilot/handoffs/ELY-TASK-000005-ci-verification.json"
  ],
  "commits": [],
  "pull_requests": ["#12"],
  "claims": [
    {
      "claim": "Executable CI completed successfully for the pre-verification PR #12 branch head a37ad0d8f839ab3935e02d2d24f894638eef7914.",
      "evidence": ["GitHub Actions run 34105729192: conclusion=success"],
      "confidence": 1.0
    },
    {
      "claim": "The CI seed-validation job executed and passed the Elysia Collective seed tests and runtime-disable safety gate.",
      "evidence": ["GitHub Actions job 101690177370 steps 5-8 all conclusion=success"],
      "confidence": 1.0
    }
  ],
  "checks": [
    {
      "name": "GitHub Actions executable verification",
      "result": "pass",
      "details": "Workflow Elysia Autopilot CI run 34105729192 completed successfully on branch head a37ad0d8f839ab3935e02d2d24f894638eef7914."
    },
    {
      "name": "test step",
      "result": "pass",
      "details": "Run Elysia Collective seed tests completed successfully in job 101690177370."
    },
    {
      "name": "runtime-disable safety gate",
      "result": "pass",
      "details": "Enforce no runtime-enable flag in seed prompt pack completed successfully."
    }
  ],
  "uncertainties": [
    "This evidence applies to head a37ad0d8f839ab3935e02d2d24f894638eef7914 before this evidence-only handoff commit. The handoff itself does not alter executable code, but the new head should receive its own CI run before any later integration decision."
  ],
  "risks": [
    "PR #12 remains intentionally draft and must not be merged into main; provider invocation and Guardian runtime wiring remain outside this verification."
  ],
  "blockers": [],
  "next_recommendation": {
    "action": "continue",
    "preferred_role": "engineer",
    "task_title": "Wire dispatcher decisions to persistent ledger in dry-run mode",
    "task_objective": "Add a runtime-disabled orchestration service that atomically dispatches eligible tasks into leases and validates completion transitions without invoking external providers."
  },
  "completed_at": "2026-09-07T10:21:33Z"
}
