{
  "task_id": "ELY-TASK-000002",
  "worker": {
    "provider": "chatgpt",
    "role": "guardian-verifier",
    "model": null,
    "run_id": null
  },
  "outcome": "partial",
  "summary": "Independently reviewed the AUTOPILOT-004 dispatcher foundation. The authority, dependency, retry, capability, and follow-up gates are structurally bounded and contain no provider/runtime invocation. Verification found one concrete schema mismatch: dispatcher.py consumes optional required_capabilities while task_packet_schema.json previously rejected that field because additionalProperties=false. The schema was corrected and regression tests were added. Execution verification remains pending because no CI status/check is currently reported for the branch head.",
  "files_read": [
    "elysia_collective_seed/autopilot/dispatcher.py",
    "elysia_collective_seed/autopilot/test_dispatcher.py",
    "elysia_collective_seed/autopilot/task_packet_schema.json",
    "elysia_collective_seed/autopilot/completion_packet_schema.json",
    "elysia_collective_seed/autopilot/handoffs/ELY-TASK-000001-completion.json"
  ],
  "files_changed": [
    "elysia_collective_seed/autopilot/task_packet_schema.json",
    "elysia_collective_seed/autopilot/test_task_schema_alignment.py",
    "elysia_collective_seed/autopilot/handoffs/ELY-TASK-000002-verification.json"
  ],
  "commits": [
    "87881d9d2f052b8cdce9be1498e4098fd7365174",
    "1cec1b6d3e1585e9a527dd408cc92adb153323da"
  ],
  "pull_requests": ["#12"],
  "claims": [
    {
      "claim": "The dispatcher does not invoke providers, execute Guardian runtime code, merge, deploy, or access credentials.",
      "evidence": ["PR #12 dispatcher.py static review"],
      "confidence": 0.99
    },
    {
      "claim": "The task schema now explicitly permits required_capabilities used by dispatcher capability routing.",
      "evidence": ["task_packet_schema.json", "test_task_schema_alignment.py"],
      "confidence": 0.99
    }
  ],
  "checks": [
    {
      "name": "independent static review",
      "result": "pass",
      "details": "Reviewed PR #12 patch independently of the implementation handoff. No external/provider/runtime execution path is present."
    },
    {
      "name": "schema-dispatcher alignment",
      "result": "pass",
      "details": "Found and repaired required_capabilities schema mismatch; added two regression tests."
    },
    {
      "name": "CI execution evidence",
      "result": "not_run",
      "details": "GitHub reports no status checks for the current branch head, so test execution cannot yet be claimed."
    }
  ],
  "uncertainties": [
    "Worker quality/cost values are not yet calibrated from outcome history.",
    "Task-class-as-required-capability is a deliberate simplification that may need separation once the worker registry matures."
  ],
  "risks": [
    "PR #12 must remain draft until executable test evidence exists.",
    "Persistent claims/leases and completion validation are not yet implemented."
  ],
  "blockers": [
    "No GitHub CI/status check is currently reported for branch head; executable verification remains unavailable from the connected GitHub interface."
  ],
  "next_recommendation": {
    "action": "continue",
    "preferred_role": "engineer",
    "task_title": "Add runtime-disabled persistent task ledger and claim leases",
    "task_objective": "Implement deterministic local persistence and lease semantics with tests, without provider invocation or Guardian runtime wiring."
  },
  "completed_at": "2026-09-07T07:35:00Z"
}
